[
  {
    "id": "local.text.343",
    "eventId": "encounter.department-security",
    "choiceId": null,
    "slot": "scene",
    "conditions": [],
    "priority": 0,
    "weight": 1,
    "once": false,
    "text": [
      "백화점 보안실의 화면에는 전원이 없다. 종이 대피도 위에는 직원이 연필로 수정한 남쪽 하역 통로와 통과 날짜가 적혀 있다."
    ]
  },
  {
    "id": "local.text.344",
    "eventId": "encounter.department-security",
    "choiceId": null,
    "slot": "scene",
    "conditions": [
      {
        "kind": "resource",
        "resource": "supply",
        "min": 0,
        "max": 0
      }
    ],
    "priority": 1,
    "weight": 1,
    "once": false,
    "text": [
      "백화점 보안실의 화면에는 전원이 없다. 종이 대피도 위에는 직원이 연필로 수정한 남쪽 하역 통로와 통과 날짜가 적혀 있다.",
      "배낭에 나눌 먹을 것이 남지 않았다. 손이 자꾸 빈 수납칸으로 간다."
    ]
  },
  {
    "id": "local.text.345",
    "eventId": "encounter.department-security",
    "choiceId": null,
    "slot": "scene",
    "conditions": [
      {
        "kind": "number",
        "subject": "protagonist",
        "stat": "injury",
        "min": 1,
        "max": 2
      }
    ],
    "priority": 2,
    "weight": 1,
    "once": false,
    "text": [
      "백화점 보안실의 화면에는 전원이 없다. 종이 대피도 위에는 직원이 연필로 수정한 남쪽 하역 통로와 통과 날짜가 적혀 있다.",
      "상처가 걸음마다 당긴다. 눈앞의 길보다 몸이 먼저 속도를 늦춘다."
    ]
  },
  {
    "id": "local.text.346",
    "eventId": "encounter.department-security",
    "choiceId": null,
    "slot": "scene",
    "conditions": [
      {
        "kind": "number",
        "subject": "protagonist",
        "stat": "stress",
        "min": 61,
        "max": 100
      }
    ],
    "priority": 3,
    "weight": 1,
    "once": false,
    "text": [
      "백화점 보안실의 화면에는 전원이 없다. 종이 대피도 위에는 직원이 연필로 수정한 남쪽 하역 통로와 통과 날짜가 적혀 있다.",
      "작은 소리에도 어깨가 움츠러든다. 숨을 천천히 세어 보지만 시선은 자꾸 뒤로 돌아간다."
    ]
  },
  {
    "id": "local.text.347",
    "eventId": "encounter.department-security",
    "choiceId": null,
    "slot": "hesitation",
    "conditions": [
      {
        "kind": "companion",
        "present": true
      }
    ],
    "priority": 0,
    "weight": 1,
    "once": false,
    "text": [
      "서두르고 싶지는 않아. 무엇을 잃을지 하나씩 생각해 보자. 네 생각도 듣고 싶어."
    ]
  },
  {
    "id": "local.text.348",
    "eventId": "encounter.department-security",
    "choiceId": null,
    "slot": "absent",
    "conditions": [
      {
        "kind": "companion",
        "present": false
      }
    ],
    "priority": 0,
    "weight": 1,
    "once": false,
    "text": [
      "곁을 돌아보려다 시선을 거뒀다. 잠시 갈라진 뒤로는 발소리와 판단 모두 내 몫이다."
    ]
  },
  {
    "id": "local.text.349",
    "eventId": "encounter.department-security",
    "choiceId": null,
    "slot": "reunion",
    "conditions": [
      {
        "kind": "companion",
        "present": true
      }
    ],
    "priority": 0,
    "weight": 1,
    "once": false,
    "text": [
      "동료가 다가와 잠시 거리를 둔다. “끝까지 같은 생각은 아니었어. 그쪽에서 무슨 일이 있었는지는 걸으면서 말할게. 네가 여기 있나 먼저 보고 싶었어.” 나도 가방을 고쳐 메고 자리를 내준다. 아까의 선택은 사라지지 않았지만, 지금은 다시 같은 길을 살핀다."
    ]
  },
  {
    "id": "local.text.350",
    "eventId": "encounter.department-security",
    "choiceId": "encounter.department-security.map",
    "slot": "success",
    "conditions": [],
    "priority": 0,
    "weight": 1,
    "once": false,
    "text": [
      "최근 날짜의 수정 표시에서 남쪽 통로가 열린 것을 확인했다. 꺼진 화면 대신 종이 대피도를 접어 경로를 기억했다."
    ]
  },
  {
    "id": "local.text.351",
    "eventId": "encounter.department-security",
    "choiceId": "encounter.department-security.map",
    "slot": "success",
    "conditions": [
      {
        "kind": "companion",
        "present": true
      },
      {
        "kind": "number",
        "subject": "protagonist",
        "stat": "injury",
        "min": 0,
        "max": 2
      }
    ],
    "priority": 2,
    "weight": 1,
    "once": false,
    "text": [
      "최근 날짜의 수정 표시에서 남쪽 통로가 열린 것을 확인했다. 꺼진 화면 대신 종이 대피도를 접어 경로를 기억했다.",
      "동료가 주변을 살피며 낮게 말한다. “어느 표지를 찾아야 할지는 알겠네. 길에 들어갈 때도 직접 확인하자.”"
    ]
  },
  {
    "id": "local.text.352",
    "eventId": "encounter.department-security",
    "choiceId": "encounter.department-security.map",
    "slot": "opinion",
    "conditions": [
      {
        "kind": "companion",
        "present": true
      }
    ],
    "priority": 0,
    "weight": 1,
    "once": false,
    "text": [
      "연필로 고친 부분이 있어. 처음 인쇄한 대피도보다 이 표시를 확인해 보자."
    ]
  },
  {
    "id": "local.text.353",
    "eventId": "encounter.department-security",
    "choiceId": "encounter.department-security.maintain",
    "slot": "success",
    "conditions": [],
    "priority": 0,
    "weight": 1,
    "once": false,
    "text": [
      "책상 아래에 짐을 내려놓고 장비를 고쳤다. 화면의 검은 반사에 출입구를 비춰 보며 호흡을 골랐다."
    ]
  },
  {
    "id": "local.text.354",
    "eventId": "encounter.department-security",
    "choiceId": "encounter.department-security.maintain",
    "slot": "success",
    "conditions": [
      {
        "kind": "companion",
        "present": true
      },
      {
        "kind": "number",
        "subject": "protagonist",
        "stat": "injury",
        "min": 0,
        "max": 2
      }
    ],
    "priority": 2,
    "weight": 1,
    "once": false,
    "text": [
      "책상 아래에 짐을 내려놓고 장비를 고쳤다. 화면의 검은 반사에 출입구를 비춰 보며 호흡을 골랐다.",
      "동료가 주변을 살피며 낮게 말한다. “조금 숨이 돌아온 것 같아. 짐을 챙기면 다시 움직이자.”"
    ]
  },
  {
    "id": "local.text.355",
    "eventId": "encounter.department-security",
    "choiceId": "encounter.department-security.maintain",
    "slot": "opinion",
    "conditions": [
      {
        "kind": "companion",
        "present": true
      }
    ],
    "priority": 0,
    "weight": 1,
    "once": false,
    "text": [
      "화면은 꺼져도 출입구는 비치네. 여기서 잠깐 쉬며 바깥을 살피자."
    ]
  },
  {
    "id": "local.text.356",
    "eventId": "encounter.department-security",
    "choiceId": "encounter.department-security.share",
    "slot": "success",
    "conditions": [],
    "priority": 0,
    "weight": 1,
    "once": false,
    "text": [
      "정비하던 짐에서 동료 몫을 덜어 건넸다. 동료가 잠시 손을 멈추고 고개를 끄덕였다."
    ]
  },
  {
    "id": "local.text.357",
    "eventId": "encounter.department-security",
    "choiceId": "encounter.department-security.share",
    "slot": "success",
    "conditions": [
      {
        "kind": "companion",
        "present": true
      },
      {
        "kind": "number",
        "subject": "protagonist",
        "stat": "injury",
        "min": 0,
        "max": 2
      }
    ],
    "priority": 2,
    "weight": 1,
    "once": false,
    "text": [
      "정비하던 짐에서 동료 몫을 덜어 건넸다. 동료가 잠시 손을 멈추고 고개를 끄덕였다.",
      "동료가 주변을 살피며 낮게 말한다. “조금 숨이 돌아온 것 같아. 짐을 챙기면 다시 움직이자.”"
    ]
  },
  {
    "id": "local.text.358",
    "eventId": "encounter.department-security",
    "choiceId": "encounter.department-security.share",
    "slot": "opinion",
    "conditions": [
      {
        "kind": "companion",
        "present": true
      }
    ],
    "priority": 0,
    "weight": 1,
    "once": false,
    "text": [
      "네 몫이 줄어드는 건 알아. 그래도 지금 나눠 준다면 잊지 않을게."
    ]
  }
]
