[
  {
    "id": "local.text.84",
    "eventId": "E02",
    "choiceId": null,
    "slot": "scene",
    "conditions": [],
    "priority": 0,
    "weight": 1,
    "once": false,
    "text": [
      "깨진 냉장고 앞에 다친 생존자가 앉아 있다. 계산대 밑에는 먹을 것이 조금 남아 있고, 생존자는 물 한 모금과 대피소에 연락할 기회를 부탁한다."
    ]
  },
  {
    "id": "local.text.85",
    "eventId": "E02",
    "choiceId": null,
    "slot": "scene",
    "conditions": [
      {
        "kind": "resource",
        "resource": "supply",
        "min": 0,
        "max": 0
      }
    ],
    "priority": 1,
    "weight": 1,
    "once": false,
    "text": [
      "깨진 냉장고 앞에 다친 생존자가 앉아 있다. 계산대 밑에는 먹을 것이 조금 남아 있고, 생존자는 물 한 모금과 대피소에 연락할 기회를 부탁한다.",
      "배낭에 나눌 먹을 것이 남지 않았다. 손이 자꾸 빈 수납칸으로 간다."
    ]
  },
  {
    "id": "local.text.86",
    "eventId": "E02",
    "choiceId": null,
    "slot": "scene",
    "conditions": [
      {
        "kind": "number",
        "subject": "protagonist",
        "stat": "injury",
        "min": 1,
        "max": 2
      }
    ],
    "priority": 2,
    "weight": 1,
    "once": false,
    "text": [
      "깨진 냉장고 앞에 다친 생존자가 앉아 있다. 계산대 밑에는 먹을 것이 조금 남아 있고, 생존자는 물 한 모금과 대피소에 연락할 기회를 부탁한다.",
      "상처가 걸음마다 당긴다. 눈앞의 길보다 몸이 먼저 속도를 늦춘다."
    ]
  },
  {
    "id": "local.text.87",
    "eventId": "E02",
    "choiceId": null,
    "slot": "scene",
    "conditions": [
      {
        "kind": "number",
        "subject": "protagonist",
        "stat": "stress",
        "min": 61,
        "max": 100
      }
    ],
    "priority": 3,
    "weight": 1,
    "once": false,
    "text": [
      "깨진 냉장고 앞에 다친 생존자가 앉아 있다. 계산대 밑에는 먹을 것이 조금 남아 있고, 생존자는 물 한 모금과 대피소에 연락할 기회를 부탁한다.",
      "작은 소리에도 어깨가 움츠러든다. 숨을 천천히 세어 보지만 시선은 자꾸 뒤로 돌아간다."
    ]
  },
  {
    "id": "local.text.88",
    "eventId": "E02",
    "choiceId": null,
    "slot": "hesitation",
    "conditions": [
      {
        "kind": "companion",
        "present": true
      }
    ],
    "priority": 0,
    "weight": 1,
    "once": false,
    "text": [
      "서두르고 싶지는 않아. 무엇을 잃을지 하나씩 생각해 보자. 네 생각도 듣고 싶어."
    ]
  },
  {
    "id": "local.text.89",
    "eventId": "E02",
    "choiceId": null,
    "slot": "absent",
    "conditions": [
      {
        "kind": "companion",
        "present": false
      }
    ],
    "priority": 0,
    "weight": 1,
    "once": false,
    "text": [
      "곁을 돌아보려다 시선을 거뒀다. 잠시 갈라진 뒤로는 발소리와 판단 모두 내 몫이다."
    ]
  },
  {
    "id": "local.text.90",
    "eventId": "E02",
    "choiceId": null,
    "slot": "reunion",
    "conditions": [
      {
        "kind": "companion",
        "present": true
      }
    ],
    "priority": 0,
    "weight": 1,
    "once": false,
    "text": [
      "동료가 다가와 잠시 거리를 둔다. “끝까지 같은 생각은 아니었어. 그쪽에서 무슨 일이 있었는지는 걸으면서 말할게. 네가 여기 있나 먼저 보고 싶었어.” 나도 가방을 고쳐 메고 자리를 내준다. 아까의 선택은 사라지지 않았지만, 지금은 다시 같은 길을 살핀다."
    ]
  },
  {
    "id": "local.text.91",
    "eventId": "E02",
    "choiceId": "E02.help",
    "slot": "success",
    "conditions": [],
    "priority": 0,
    "weight": 1,
    "once": false,
    "text": [
      "먹을 것과 마실 물을 나눠 주었다. 생존자가 숨을 고른 뒤 대피소에서 쓰는 연락 주파수를 알려 주었다."
    ]
  },
  {
    "id": "local.text.92",
    "eventId": "E02",
    "choiceId": "E02.help",
    "slot": "success",
    "conditions": [
      {
        "kind": "companion",
        "present": true
      },
      {
        "kind": "number",
        "subject": "protagonist",
        "stat": "injury",
        "min": 0,
        "max": 2
      }
    ],
    "priority": 2,
    "weight": 1,
    "once": false,
    "text": [
      "먹을 것과 마실 물을 나눠 주었다. 생존자가 숨을 고른 뒤 대피소에서 쓰는 연락 주파수를 알려 주었다.",
      "동료가 주변을 살피며 낮게 말한다. “저 사람이 숨을 고르는 걸 보니 나도 조금 놓여. 우리도 출구를 살피자.”"
    ]
  },
  {
    "id": "local.text.93",
    "eventId": "E02",
    "choiceId": "E02.help",
    "slot": "opinion",
    "conditions": [
      {
        "kind": "companion",
        "present": true
      }
    ],
    "priority": 0,
    "weight": 1,
    "once": false,
    "text": [
      "계산대 앞까지 기어온 모양이야. 여기서 마실 것부터 나누자. 저대로 두고 나가고 싶지는 않아."
    ]
  },
  {
    "id": "local.text.94",
    "eventId": "E02",
    "choiceId": "E02.supplies",
    "slot": "success",
    "conditions": [],
    "priority": 0,
    "weight": 1,
    "once": false,
    "text": [
      "계산대 밑의 먹을 것을 챙겼다. 생존자와 시선을 맞추지 못한 채 편의점 문을 밀었다."
    ]
  },
  {
    "id": "local.text.95",
    "eventId": "E02",
    "choiceId": "E02.supplies",
    "slot": "success",
    "conditions": [
      {
        "kind": "companion",
        "present": true
      },
      {
        "kind": "number",
        "subject": "protagonist",
        "stat": "injury",
        "min": 0,
        "max": 2
      }
    ],
    "priority": 2,
    "weight": 1,
    "once": false,
    "text": [
      "계산대 밑의 먹을 것을 챙겼다. 생존자와 시선을 맞추지 못한 채 편의점 문을 밀었다.",
      "동료가 주변을 살피며 낮게 말한다. “가지고 갈 몫은 골랐어. 더 뒤지다 여기 갇히고 싶지는 않아.”"
    ]
  },
  {
    "id": "local.text.96",
    "eventId": "E02",
    "choiceId": "E02.supplies",
    "slot": "opinion",
    "conditions": [
      {
        "kind": "companion",
        "present": true
      }
    ],
    "priority": 0,
    "weight": 1,
    "once": false,
    "text": [
      "남은 음식은 챙기자. 우리도 다음 구역까지 버텨야 해. 누군가에게 남기는 일이 이렇게 어려울 줄은 몰랐네."
    ]
  },
  {
    "id": "local.text.97",
    "eventId": "E02",
    "choiceId": "E02.first-aid",
    "slot": "success",
    "conditions": [],
    "priority": 0,
    "weight": 1,
    "once": false,
    "text": [
      "생존자의 다리에 붕대를 감고 물병을 손 가까이에 놓았다. 생존자는 고맙다는 말 대신 연락 주파수를 천천히 불러 주었다."
    ]
  },
  {
    "id": "local.text.98",
    "eventId": "E02",
    "choiceId": "E02.first-aid",
    "slot": "success",
    "conditions": [
      {
        "kind": "companion",
        "present": true
      },
      {
        "kind": "number",
        "subject": "protagonist",
        "stat": "injury",
        "min": 0,
        "max": 2
      }
    ],
    "priority": 2,
    "weight": 1,
    "once": false,
    "text": [
      "생존자의 다리에 붕대를 감고 물병을 손 가까이에 놓았다. 생존자는 고맙다는 말 대신 연락 주파수를 천천히 불러 주었다.",
      "동료가 주변을 살피며 낮게 말한다. “저 사람이 숨을 고르는 걸 보니 나도 조금 놓여. 우리도 출구를 살피자.”"
    ]
  },
  {
    "id": "local.text.99",
    "eventId": "E02",
    "choiceId": "E02.first-aid",
    "slot": "opinion",
    "conditions": [
      {
        "kind": "companion",
        "present": true
      }
    ],
    "priority": 0,
    "weight": 1,
    "once": false,
    "text": [
      "다리가 저렇게 묶여 있으면 움직이지도 못해. 붕대를 써서라도 문밖으로 나갈 수 있게 돕자."
    ]
  },
  {
    "id": "local.text.100",
    "eventId": "E02",
    "choiceId": "E02.help",
    "slot": "departure-warning",
    "conditions": [
      {
        "kind": "companion",
        "present": true
      }
    ],
    "priority": 0,
    "weight": 1,
    "once": false,
    "text": [
      "“나는 저 사람을 두고 갈 수 없어. 네가 먼저 떠나도 여기 남아서 도울 생각이야.” 동료가 출구보다 도움을 청하는 쪽을 바라본다."
    ]
  },
  {
    "id": "local.text.101",
    "eventId": "E02",
    "choiceId": "E02.help",
    "slot": "departure",
    "conditions": [
      {
        "kind": "companion",
        "present": true
      }
    ],
    "priority": 0,
    "weight": 1,
    "once": false,
    "text": [
      "동료가 도움을 청하는 쪽으로 돌아선다. “지금 네 길을 막지는 않을게. 하지만 나는 확인하고 가야 해. 살아서 다음 거점에서 보자.” 서로의 발소리가 다른 방향으로 멀어진다."
    ]
  },
  {
    "id": "local.text.102",
    "eventId": "E02",
    "choiceId": "E02.supplies",
    "slot": "departure-warning",
    "conditions": [
      {
        "kind": "companion",
        "present": true
      }
    ],
    "priority": 0,
    "weight": 1,
    "once": false,
    "text": [
      "“나는 저 사람을 두고 갈 수 없어. 네가 먼저 떠나도 여기 남아서 도울 생각이야.” 동료가 출구보다 도움을 청하는 쪽을 바라본다."
    ]
  },
  {
    "id": "local.text.103",
    "eventId": "E02",
    "choiceId": "E02.supplies",
    "slot": "departure",
    "conditions": [
      {
        "kind": "companion",
        "present": true
      }
    ],
    "priority": 0,
    "weight": 1,
    "once": false,
    "text": [
      "동료가 도움을 청하는 쪽으로 돌아선다. “지금 네 길을 막지는 않을게. 하지만 나는 확인하고 가야 해. 살아서 다음 거점에서 보자.” 서로의 발소리가 다른 방향으로 멀어진다."
    ]
  },
  {
    "id": "local.text.104",
    "eventId": "E02",
    "choiceId": "E02.first-aid",
    "slot": "departure-warning",
    "conditions": [
      {
        "kind": "companion",
        "present": true
      }
    ],
    "priority": 0,
    "weight": 1,
    "once": false,
    "text": [
      "“나는 저 사람을 두고 갈 수 없어. 네가 먼저 떠나도 여기 남아서 도울 생각이야.” 동료가 출구보다 도움을 청하는 쪽을 바라본다."
    ]
  },
  {
    "id": "local.text.105",
    "eventId": "E02",
    "choiceId": "E02.first-aid",
    "slot": "departure",
    "conditions": [
      {
        "kind": "companion",
        "present": true
      }
    ],
    "priority": 0,
    "weight": 1,
    "once": false,
    "text": [
      "동료가 도움을 청하는 쪽으로 돌아선다. “지금 네 길을 막지는 않을게. 하지만 나는 확인하고 가야 해. 살아서 다음 거점에서 보자.” 서로의 발소리가 다른 방향으로 멀어진다."
    ]
  }
]
