[
  {
    "id": "E10.scene",
    "eventId": "E10",
    "choiceId": null,
    "slot": "scene",
    "conditions": [],
    "priority": 0,
    "weight": 1,
    "once": false,
    "text": [
      "격리선을 벗어나자 통신소의 확성기에서 구조 차량의 신호가 끊겨 들린다. 외곽 집결지로 향하는 표지는 있지만, 어느 통로가 열려 있는지는 알 수 없다.",
      "쓰러진 안내판 뒤에서 사람이 도움을 청한다. 신호를 확인하고 이동하거나, 잔해에 갇힌 생존자를 구조할 수 있다."
    ]
  },
  {
    "id": "E10.scene.network",
    "eventId": "E10",
    "choiceId": null,
    "slot": "scene",
    "conditions": [
      {
        "kind": "flag",
        "flag": "helpEstablished",
        "value": true
      }
    ],
    "priority": 5,
    "weight": 1,
    "once": false,
    "text": [
      "격리선을 지나 통신소에 도착하자, 편의점에서 도왔던 사람이 알려 준 호출 번호가 떠오른다. 이 연락망으로 외곽의 열린 통로를 물어볼 수 있다.",
      "한편 쓰러진 안내판 뒤에서는 생존자가 도움을 청한다. 통로 정보를 먼저 얻을지, 위험을 감수하고 구조할지 결정해야 한다."
    ]
  },
  {
    "id": "E10.scene.extreme",
    "eventId": "E10",
    "choiceId": null,
    "slot": "scene",
    "conditions": [
      {
        "kind": "number",
        "subject": "protagonist",
        "stat": "affect",
        "min": 78,
        "max": 100
      }
    ],
    "priority": 10,
    "weight": 1,
    "once": false,
    "text": [
      "통신소의 구조 신호 사이로 잔해에 갇힌 사람의 목소리가 들린다. 지금은 먼저 그 사람을 꺼내야 한다는 생각이 앞선다.",
      "곧장 들어가거나 물자로 잔해를 받칠 수 있다. 치료 도구로 보호하거나 체력을 더 써 옆으로 진입하는 방식도 있다."
    ]
  },
  {
    "id": "E10.signal.success",
    "eventId": "E10",
    "choiceId": "E10.signal",
    "slot": "success",
    "conditions": [],
    "priority": 0,
    "weight": 1,
    "once": false,
    "text": [
      "확성기 주파수와 집결 방향을 확인했다. 응답할 연락처가 없어 열린 통로까지는 알아내지 못했다. 뒤쪽 생존자는 구조 요청을 계속 보냈다."
    ]
  },
  {
    "id": "E10.network.success",
    "eventId": "E10",
    "choiceId": "E10.network",
    "slot": "success",
    "conditions": [],
    "priority": 0,
    "weight": 1,
    "once": false,
    "text": [
      "편의점에서 도왔던 사람이 연결해 준 연락망에 응답이 왔다. 통신 상대가 외곽의 열린 우회 통로를 짚어 주었다. 탈출 통로 정보를 확보했다.",
      "잔해 안의 사람에게는 구조 요청 신호가 이어지고 있음을 알리고, 다음 구역으로 향했다."
    ]
  },
  {
    "id": "E10.rescue.success",
    "eventId": "E10",
    "choiceId": "E10.rescue",
    "slot": "success",
    "conditions": [],
    "priority": 0,
    "weight": 1,
    "once": false,
    "text": [
      "생존자를 잔해 밖으로 꺼냈다. 그 사람은 고맙다며 들고 있던 물자 하나를 나누어 주었다. 잠시 숨을 고른 뒤 각자 집결지로 향했다."
    ]
  },
  {
    "id": "E10.rescue.failure",
    "eventId": "E10",
    "choiceId": "E10.rescue",
    "slot": "failure",
    "conditions": [],
    "priority": 0,
    "weight": 1,
    "once": false,
    "text": [
      "구조를 시도하다 잔해에 부딪혀 상처를 입었다. 안쪽 생존자는 다른 구조 요청에도 응답하겠다며 먼저 안전한 곳으로 빠지라고 외쳤다.",
      "사용한 물품과 체력을 되돌릴 수는 없다. 생존자를 꺼내지 못한 채 상처와 긴장을 안고 통신소 가장자리로 물러났다."
    ]
  },
  {
    "id": "E10.beacon.success",
    "eventId": "E10",
    "choiceId": "E10.beacon",
    "slot": "success",
    "conditions": [],
    "priority": 0,
    "weight": 1,
    "once": false,
    "text": [
      "물자로 표지를 고정하자 구조 신호의 방향이 분명해졌다. 긴장이 조금 풀렸다. 열린 탈출 통로 정보는 얻지 못했고, 생존자는 잔해 안에서 구조 요청을 이어 갔다."
    ]
  },
  {
    "id": "E10.aid.success",
    "eventId": "E10",
    "choiceId": "E10.aid",
    "slot": "success",
    "conditions": [],
    "priority": 0,
    "weight": 1,
    "once": false,
    "text": [
      "치료 도구로 생존자의 상처를 감싼 뒤 잔해 밖으로 이끌었다. 생존자는 고맙다며 물자 하나를 건넸다. 내 상처가 함께 낫는 것은 아니지만 그 사람은 움직일 수 있게 되었다."
    ]
  },
  {
    "id": "E10.aid.failure",
    "eventId": "E10",
    "choiceId": "E10.aid",
    "slot": "failure",
    "conditions": [],
    "priority": 0,
    "weight": 1,
    "once": false,
    "text": [
      "구조를 시도하다 잔해에 부딪혀 상처를 입었다. 안쪽 생존자는 다른 구조 요청에도 응답하겠다며 먼저 안전한 곳으로 빠지라고 외쳤다.",
      "사용한 물품과 체력을 되돌릴 수는 없다. 생존자를 꺼내지 못한 채 상처와 긴장을 안고 통신소 가장자리로 물러났다."
    ]
  },
  {
    "id": "E10.rush.success",
    "eventId": "E10",
    "choiceId": "E10.rush",
    "slot": "success",
    "conditions": [],
    "priority": 0,
    "weight": 1,
    "once": false,
    "text": [
      "잔해 안으로 들어가 생존자를 끌어냈다. 팔에 힘이 풀렸지만 그 사람의 안도하는 목소리에 긴장이 조금 내려갔다. 생존자는 물자 하나를 나누어 주고 집결지로 향했다."
    ]
  },
  {
    "id": "E10.rush.failure",
    "eventId": "E10",
    "choiceId": "E10.rush",
    "slot": "failure",
    "conditions": [],
    "priority": 0,
    "weight": 1,
    "once": false,
    "text": [
      "구조를 시도하다 잔해에 부딪혀 상처를 입었다. 안쪽 생존자는 다른 구조 요청에도 응답하겠다며 먼저 안전한 곳으로 빠지라고 외쳤다.",
      "사용한 물품과 체력을 되돌릴 수는 없다. 생존자를 꺼내지 못한 채 상처와 긴장을 안고 통신소 가장자리로 물러났다."
    ]
  },
  {
    "id": "E10.prepare.success",
    "eventId": "E10",
    "choiceId": "E10.prepare",
    "slot": "success",
    "conditions": [],
    "priority": 0,
    "weight": 1,
    "once": false,
    "text": [
      "물자로 잔해를 받쳐 생존자를 꺼냈다. 생존자가 물자 하나를 건네 사용한 만큼을 보충했다. 숨을 고르자 긴장이 내려갔다."
    ]
  },
  {
    "id": "E10.prepare.failure",
    "eventId": "E10",
    "choiceId": "E10.prepare",
    "slot": "failure",
    "conditions": [],
    "priority": 0,
    "weight": 1,
    "once": false,
    "text": [
      "구조를 시도하다 잔해에 부딪혀 상처를 입었다. 안쪽 생존자는 다른 구조 요청에도 응답하겠다며 먼저 안전한 곳으로 빠지라고 외쳤다.",
      "사용한 물품과 체력을 되돌릴 수는 없다. 생존자를 꺼내지 못한 채 상처와 긴장을 안고 통신소 가장자리로 물러났다."
    ]
  },
  {
    "id": "E10.wrap.success",
    "eventId": "E10",
    "choiceId": "E10.wrap",
    "slot": "success",
    "conditions": [],
    "priority": 0,
    "weight": 1,
    "once": false,
    "text": [
      "치료 도구로 생존자를 보호한 뒤 잔해 밖으로 이끌었다. 그 사람은 물자 하나를 건네고 거듭 고맙다고 말했다. 긴장이 내려갔지만 내 부상은 그대로였다."
    ]
  },
  {
    "id": "E10.wrap.failure",
    "eventId": "E10",
    "choiceId": "E10.wrap",
    "slot": "failure",
    "conditions": [],
    "priority": 0,
    "weight": 1,
    "once": false,
    "text": [
      "구조를 시도하다 잔해에 부딪혀 상처를 입었다. 안쪽 생존자는 다른 구조 요청에도 응답하겠다며 먼저 안전한 곳으로 빠지라고 외쳤다.",
      "사용한 물품과 체력을 되돌릴 수는 없다. 생존자를 꺼내지 못한 채 상처와 긴장을 안고 통신소 가장자리로 물러났다."
    ]
  },
  {
    "id": "E10.haul.success",
    "eventId": "E10",
    "choiceId": "E10.haul",
    "slot": "success",
    "conditions": [],
    "priority": 0,
    "weight": 1,
    "once": false,
    "text": [
      "옆으로 돌아 잔해를 들어 올리고 생존자를 끌어냈다. 체력을 많이 썼지만 그 사람이 빠져나오자 조금 안도했다. 생존자는 물자 하나를 나누어 주었다."
    ]
  },
  {
    "id": "E10.haul.failure",
    "eventId": "E10",
    "choiceId": "E10.haul",
    "slot": "failure",
    "conditions": [],
    "priority": 0,
    "weight": 1,
    "once": false,
    "text": [
      "구조를 시도하다 잔해에 부딪혀 상처를 입었다. 안쪽 생존자는 다른 구조 요청에도 응답하겠다며 먼저 안전한 곳으로 빠지라고 외쳤다.",
      "사용한 물품과 체력을 되돌릴 수는 없다. 생존자를 꺼내지 못한 채 상처와 긴장을 안고 통신소 가장자리로 물러났다."
    ]
  }
]
