[
  {
    "id": "local.text.819",
    "eventId": "encounter.department-parking",
    "choiceId": "encounter.department-parking.subway",
    "slot": "success",
    "conditions": [],
    "priority": 0,
    "weight": 1,
    "once": false,
    "text": [
      "하역차를 돌아 지하철 표지 쪽으로 나섰다. 지하의 작업 통로가 남쪽으로 이어지는지 확인해야 한다."
    ]
  },
  {
    "id": "local.text.820",
    "eventId": "encounter.department-parking",
    "choiceId": "encounter.department-parking.subway",
    "slot": "opinion",
    "conditions": [
      {
        "kind": "companion",
        "present": true
      }
    ],
    "priority": 0,
    "weight": 1,
    "once": false,
    "text": [
      "“노출된 도로를 오래 걷는 건 걱정돼. 지하로 내려가 보자.”"
    ]
  },
  {
    "id": "local.text.821",
    "eventId": "encounter.department-parking",
    "choiceId": "encounter.department-parking.school",
    "slot": "success",
    "conditions": [],
    "priority": 0,
    "weight": 1,
    "once": false,
    "text": [
      "주차장을 나와 학교 운동장 쪽으로 걸었다. 학교 안을 찾는 대신 외곽으로 떠날 사람들을 만날 생각이다."
    ]
  },
  {
    "id": "local.text.822",
    "eventId": "encounter.department-parking",
    "choiceId": "encounter.department-parking.school",
    "slot": "opinion",
    "conditions": [
      {
        "kind": "companion",
        "present": true
      }
    ],
    "priority": 0,
    "weight": 1,
    "once": false,
    "text": [
      "“운동장 접선 시간이 적혀 있어. 늦기 전에 떠날 사람들을 찾아가자.”"
    ]
  },
  {
    "id": "local.text.825",
    "eventId": "encounter.department-parking",
    "choiceId": null,
    "slot": "scene",
    "conditions": [],
    "priority": 0,
    "weight": 1,
    "once": false,
    "text": [
      "백화점 주차장 출구에서 지하철 표지와 학교 운동장 접선 안내를 번갈아 본다. 이제 남쪽으로 향할 길을 정해야 한다.",
      "하역차의 연구동 표지는 글자가 벗겨져 있다. 어디로 들어가는지는 적혀 있지 않다. 여기서 확인할 수 있는 길은 지하철과 학교 쪽이다."
    ]
  },
  {
    "id": "local.text.826",
    "eventId": "encounter.department-parking",
    "choiceId": null,
    "slot": "scene",
    "conditions": [
      {
        "kind": "resource",
        "resource": "supply",
        "min": 0,
        "max": 0
      }
    ],
    "priority": 1,
    "weight": 1,
    "once": false,
    "text": [
      "백화점 주차장 출구에서 지하철 표지와 학교 운동장 접선 안내를 번갈아 본다. 이제 남쪽으로 향할 길을 정해야 한다.",
      "하역차의 연구동 표지는 글자가 벗겨져 있다. 어디로 들어가는지는 적혀 있지 않다. 여기서 확인할 수 있는 길은 지하철과 학교 쪽이다.",
      "배낭의 식량 주머니를 더듬지만 꺼낼 것은 없다."
    ]
  },
  {
    "id": "local.text.827",
    "eventId": "encounter.department-parking",
    "choiceId": null,
    "slot": "scene",
    "conditions": [
      {
        "kind": "number",
        "subject": "protagonist",
        "stat": "injury",
        "min": 1,
        "max": 2
      }
    ],
    "priority": 2,
    "weight": 1,
    "once": false,
    "text": [
      "백화점 주차장 출구에서 지하철 표지와 학교 운동장 접선 안내를 번갈아 본다. 이제 남쪽으로 향할 길을 정해야 한다.",
      "하역차의 연구동 표지는 글자가 벗겨져 있다. 어디로 들어가는지는 적혀 있지 않다. 여기서 확인할 수 있는 길은 지하철과 학교 쪽이다.",
      "발 디딜 곳을 고르다가 다친 곳부터 의식하게 된다."
    ]
  },
  {
    "id": "local.text.828",
    "eventId": "encounter.department-parking",
    "choiceId": null,
    "slot": "scene",
    "conditions": [
      {
        "kind": "number",
        "subject": "protagonist",
        "stat": "stress",
        "min": 61,
        "max": 100
      }
    ],
    "priority": 3,
    "weight": 1,
    "once": false,
    "text": [
      "백화점 주차장 출구에서 지하철 표지와 학교 운동장 접선 안내를 번갈아 본다. 이제 남쪽으로 향할 길을 정해야 한다.",
      "하역차의 연구동 표지는 글자가 벗겨져 있다. 어디로 들어가는지는 적혀 있지 않다. 여기서 확인할 수 있는 길은 지하철과 학교 쪽이다.",
      "움직이는 것을 본 듯해 잠시 멈춘다. 한 번 더 확인해야 마음이 놓일 것 같다."
    ]
  },
  {
    "id": "local.text.829",
    "eventId": "encounter.department-parking",
    "choiceId": null,
    "slot": "hesitation",
    "conditions": [
      {
        "kind": "companion",
        "present": true
      }
    ],
    "priority": 0,
    "weight": 1,
    "once": false,
    "text": [
      "동료가 두 표지 앞에서 멈춘다. “밖의 행렬도, 지하 통로도 직접 본 건 아니잖아. 네 생각을 듣고 싶어.”"
    ]
  },
  {
    "id": "local.text.830",
    "eventId": "encounter.department-parking",
    "choiceId": null,
    "slot": "absent",
    "conditions": [
      {
        "kind": "companion",
        "present": false
      }
    ],
    "priority": 0,
    "weight": 1,
    "once": false,
    "text": [
      "출구 쪽을 살피다 곁을 돌아본다. 옆에서 답해 줄 목소리는 없다."
    ]
  },
  {
    "id": "local.text.831",
    "eventId": "encounter.department-parking",
    "choiceId": null,
    "slot": "reunion",
    "conditions": [
      {
        "kind": "companion",
        "present": true
      }
    ],
    "priority": 0,
    "weight": 1,
    "once": false,
    "text": [
      "앞쪽에서 익숙한 얼굴이 보인다. 서로를 알아보고 걸음을 멈춘다. 동료가 먼저 입을 연다. “여기서 다시 만났네.”",
      "잠깐 말을 고르다 옆자리를 내준다. 헤어질 때의 생각이 모두 풀린 것은 아니다. 그래도 이번에는 같은 길을 바라보며 나란히 짐을 고쳐 멘다."
    ]
  }
]
