[
  {
    "id": "local.text.327",
    "eventId": "encounter.clothing-store",
    "choiceId": null,
    "slot": "scene",
    "conditions": [],
    "priority": 0,
    "weight": 1,
    "once": false,
    "text": [
      "의류 매장 안쪽에는 젖지 않은 바닥과 직원용 의자가 있다. 뜯어진 옷걸이를 피하면 짐을 펼칠 수 있지만, 옷을 갈아입는다고 상처가 낫지는 않는다."
    ]
  },
  {
    "id": "local.text.328",
    "eventId": "encounter.clothing-store",
    "choiceId": null,
    "slot": "scene",
    "conditions": [
      {
        "kind": "resource",
        "resource": "supply",
        "min": 0,
        "max": 0
      }
    ],
    "priority": 1,
    "weight": 1,
    "once": false,
    "text": [
      "의류 매장 안쪽에는 젖지 않은 바닥과 직원용 의자가 있다. 뜯어진 옷걸이를 피하면 짐을 펼칠 수 있지만, 옷을 갈아입는다고 상처가 낫지는 않는다.",
      "배낭에 나눌 먹을 것이 남지 않았다. 손이 자꾸 빈 수납칸으로 간다."
    ]
  },
  {
    "id": "local.text.329",
    "eventId": "encounter.clothing-store",
    "choiceId": null,
    "slot": "scene",
    "conditions": [
      {
        "kind": "number",
        "subject": "protagonist",
        "stat": "injury",
        "min": 1,
        "max": 2
      }
    ],
    "priority": 2,
    "weight": 1,
    "once": false,
    "text": [
      "의류 매장 안쪽에는 젖지 않은 바닥과 직원용 의자가 있다. 뜯어진 옷걸이를 피하면 짐을 펼칠 수 있지만, 옷을 갈아입는다고 상처가 낫지는 않는다.",
      "상처가 걸음마다 당긴다. 눈앞의 길보다 몸이 먼저 속도를 늦춘다."
    ]
  },
  {
    "id": "local.text.330",
    "eventId": "encounter.clothing-store",
    "choiceId": null,
    "slot": "scene",
    "conditions": [
      {
        "kind": "number",
        "subject": "protagonist",
        "stat": "stress",
        "min": 61,
        "max": 100
      }
    ],
    "priority": 3,
    "weight": 1,
    "once": false,
    "text": [
      "의류 매장 안쪽에는 젖지 않은 바닥과 직원용 의자가 있다. 뜯어진 옷걸이를 피하면 짐을 펼칠 수 있지만, 옷을 갈아입는다고 상처가 낫지는 않는다.",
      "작은 소리에도 어깨가 움츠러든다. 숨을 천천히 세어 보지만 시선은 자꾸 뒤로 돌아간다."
    ]
  },
  {
    "id": "local.text.331",
    "eventId": "encounter.clothing-store",
    "choiceId": null,
    "slot": "hesitation",
    "conditions": [
      {
        "kind": "companion",
        "present": true
      }
    ],
    "priority": 0,
    "weight": 1,
    "once": false,
    "text": [
      "서두르고 싶지는 않아. 무엇을 잃을지 하나씩 생각해 보자. 네 생각도 듣고 싶어."
    ]
  },
  {
    "id": "local.text.332",
    "eventId": "encounter.clothing-store",
    "choiceId": null,
    "slot": "absent",
    "conditions": [
      {
        "kind": "companion",
        "present": false
      }
    ],
    "priority": 0,
    "weight": 1,
    "once": false,
    "text": [
      "곁을 돌아보려다 시선을 거뒀다. 잠시 갈라진 뒤로는 발소리와 판단 모두 내 몫이다."
    ]
  },
  {
    "id": "local.text.333",
    "eventId": "encounter.clothing-store",
    "choiceId": null,
    "slot": "reunion",
    "conditions": [
      {
        "kind": "companion",
        "present": true
      }
    ],
    "priority": 0,
    "weight": 1,
    "once": false,
    "text": [
      "동료가 다가와 잠시 거리를 둔다. “끝까지 같은 생각은 아니었어. 그쪽에서 무슨 일이 있었는지는 걸으면서 말할게. 네가 여기 있나 먼저 보고 싶었어.” 나도 가방을 고쳐 메고 자리를 내준다. 아까의 선택은 사라지지 않았지만, 지금은 다시 같은 길을 살핀다."
    ]
  },
  {
    "id": "local.text.334",
    "eventId": "encounter.clothing-store",
    "choiceId": "encounter.clothing-store.maintain",
    "slot": "success",
    "conditions": [],
    "priority": 0,
    "weight": 1,
    "once": false,
    "text": [
      "의자에 앉아 젖은 짐을 털고 느슨해진 배낭 끈을 묶었다. 매장 밖 발소리가 멀어지는 동안 몸을 추슬렀다."
    ]
  },
  {
    "id": "local.text.335",
    "eventId": "encounter.clothing-store",
    "choiceId": "encounter.clothing-store.maintain",
    "slot": "success",
    "conditions": [
      {
        "kind": "companion",
        "present": true
      },
      {
        "kind": "number",
        "subject": "protagonist",
        "stat": "injury",
        "min": 0,
        "max": 2
      }
    ],
    "priority": 2,
    "weight": 1,
    "once": false,
    "text": [
      "의자에 앉아 젖은 짐을 털고 느슨해진 배낭 끈을 묶었다. 매장 밖 발소리가 멀어지는 동안 몸을 추슬렀다.",
      "동료가 주변을 살피며 낮게 말한다. “조금 숨이 돌아온 것 같아. 짐을 챙기면 다시 움직이자.”"
    ]
  },
  {
    "id": "local.text.336",
    "eventId": "encounter.clothing-store",
    "choiceId": "encounter.clothing-store.maintain",
    "slot": "opinion",
    "conditions": [
      {
        "kind": "companion",
        "present": true
      }
    ],
    "priority": 0,
    "weight": 1,
    "once": false,
    "text": [
      "여기는 바닥이 말라 있어. 배낭부터 다시 묶자. 계속 흘러내리고 있잖아."
    ]
  },
  {
    "id": "local.text.337",
    "eventId": "encounter.clothing-store",
    "choiceId": "encounter.clothing-store.leave",
    "slot": "success",
    "conditions": [],
    "priority": 0,
    "weight": 1,
    "once": false,
    "text": [
      "늘어진 옷걸이를 피하고 매장 밖으로 나갔다. 잠깐 머물 자리는 뒤에 남았다."
    ]
  },
  {
    "id": "local.text.338",
    "eventId": "encounter.clothing-store",
    "choiceId": "encounter.clothing-store.leave",
    "slot": "success",
    "conditions": [
      {
        "kind": "companion",
        "present": true
      },
      {
        "kind": "number",
        "subject": "protagonist",
        "stat": "injury",
        "min": 0,
        "max": 2
      }
    ],
    "priority": 2,
    "weight": 1,
    "once": false,
    "text": [
      "늘어진 옷걸이를 피하고 매장 밖으로 나갔다. 잠깐 머물 자리는 뒤에 남았다.",
      "동료가 주변을 살피며 낮게 말한다. “여기서 오래 머물고 싶지는 않아. 다음 길도 소리부터 듣자.”"
    ]
  },
  {
    "id": "local.text.339",
    "eventId": "encounter.clothing-store",
    "choiceId": "encounter.clothing-store.leave",
    "slot": "opinion",
    "conditions": [
      {
        "kind": "companion",
        "present": true
      }
    ],
    "priority": 0,
    "weight": 1,
    "once": false,
    "text": [
      "안쪽까지 들어가면 출구가 안 보여. 지금은 표지를 따라 계속 가고 싶어."
    ]
  },
  {
    "id": "local.text.340",
    "eventId": "encounter.clothing-store",
    "choiceId": "encounter.clothing-store.share",
    "slot": "success",
    "conditions": [],
    "priority": 0,
    "weight": 1,
    "once": false,
    "text": [
      "정비하던 짐에서 동료 몫을 덜어 건넸다. 동료가 잠시 손을 멈추고 고개를 끄덕였다."
    ]
  },
  {
    "id": "local.text.341",
    "eventId": "encounter.clothing-store",
    "choiceId": "encounter.clothing-store.share",
    "slot": "success",
    "conditions": [
      {
        "kind": "companion",
        "present": true
      },
      {
        "kind": "number",
        "subject": "protagonist",
        "stat": "injury",
        "min": 0,
        "max": 2
      }
    ],
    "priority": 2,
    "weight": 1,
    "once": false,
    "text": [
      "정비하던 짐에서 동료 몫을 덜어 건넸다. 동료가 잠시 손을 멈추고 고개를 끄덕였다.",
      "동료가 주변을 살피며 낮게 말한다. “조금 숨이 돌아온 것 같아. 짐을 챙기면 다시 움직이자.”"
    ]
  },
  {
    "id": "local.text.342",
    "eventId": "encounter.clothing-store",
    "choiceId": "encounter.clothing-store.share",
    "slot": "opinion",
    "conditions": [
      {
        "kind": "companion",
        "present": true
      }
    ],
    "priority": 0,
    "weight": 1,
    "once": false,
    "text": [
      "네 몫이 줄어드는 건 알아. 그래도 지금 나눠 준다면 잊지 않을게."
    ]
  }
]
