[
  {
    "id": "local.text.806",
    "eventId": "encounter.inpatient-ward",
    "choiceId": "encounter.inpatient-ward.subway",
    "slot": "success",
    "conditions": [],
    "priority": 0,
    "weight": 1,
    "once": false,
    "text": [
      "병동을 나와 지하철 비상 출입구 방향으로 걸었다. 선로를 따라 도시 남쪽으로 갈 길을 찾아야 한다."
    ]
  },
  {
    "id": "local.text.807",
    "eventId": "encounter.inpatient-ward",
    "choiceId": "encounter.inpatient-ward.subway",
    "slot": "opinion",
    "conditions": [
      {
        "kind": "companion",
        "present": true
      }
    ],
    "priority": 0,
    "weight": 1,
    "once": false,
    "text": [
      "거리의 무리가 걱정돼. 아래쪽 통로를 찾아보고 싶어."
    ]
  },
  {
    "id": "local.text.808",
    "eventId": "encounter.inpatient-ward",
    "choiceId": "encounter.inpatient-ward.school",
    "slot": "success",
    "conditions": [],
    "priority": 0,
    "weight": 1,
    "once": false,
    "text": [
      "병동을 나와 학교 운동장으로 향했다. 접선 뒤에는 생존자들과 외곽으로 이동할 생각이다."
    ]
  },
  {
    "id": "local.text.809",
    "eventId": "encounter.inpatient-ward",
    "choiceId": "encounter.inpatient-ward.school",
    "slot": "opinion",
    "conditions": [
      {
        "kind": "companion",
        "present": true
      }
    ],
    "priority": 0,
    "weight": 1,
    "once": false,
    "text": [
      "운동장에 떠날 사람들이 모인다잖아. 같은 방향으로 걷는 사람을 만나고 싶어."
    ]
  },
  {
    "id": "local.text.810",
    "eventId": "encounter.inpatient-ward",
    "choiceId": "encounter.inpatient-ward.research",
    "slot": "success",
    "conditions": [],
    "priority": 0,
    "weight": 1,
    "once": false,
    "text": [
      "수송 기록에 적힌 직원 출입로를 찾았다. 봉쇄문 안쪽으로 날카로운 긁는 소리가 이어진다."
    ]
  },
  {
    "id": "local.text.811",
    "eventId": "encounter.inpatient-ward",
    "choiceId": "encounter.inpatient-ward.research",
    "slot": "opinion",
    "conditions": [
      {
        "kind": "companion",
        "present": true
      }
    ],
    "priority": 0,
    "weight": 1,
    "once": false,
    "text": [
      "길을 확인했으니 들어갈 수는 있어. 하지만 안쪽 소리가 이상해. 치료제 기록을 찾으려면 돌아올 길부터 기억하자."
    ]
  },
  {
    "id": "local.text.812",
    "eventId": "encounter.inpatient-ward",
    "choiceId": null,
    "slot": "scene",
    "conditions": [],
    "priority": 0,
    "weight": 1,
    "once": false,
    "text": [
      "병동 끝 지도에 지하철 진입로와 학교 운동장 접선지가 표시돼 있다. 어느 길로 남쪽을 향할지 결정할 때다.",
      "그 옆에는 봉쇄된 연구동의 수송 표지가 붙어 있다. 표지만 보고 출입로를 찾기는 어렵다. 병원에서 조사한 기록이 있다면 대조할 수 있을 듯하다."
    ]
  },
  {
    "id": "local.text.813",
    "eventId": "encounter.inpatient-ward",
    "choiceId": null,
    "slot": "scene",
    "conditions": [
      {
        "kind": "resource",
        "resource": "supply",
        "min": 0,
        "max": 0
      }
    ],
    "priority": 1,
    "weight": 1,
    "once": false,
    "text": [
      "병동 끝 지도에 지하철 진입로와 학교 운동장 접선지가 표시돼 있다. 어느 길로 남쪽을 향할지 결정할 때다.",
      "그 옆에는 봉쇄된 연구동의 수송 표지가 붙어 있다. 표지만 보고 출입로를 찾기는 어렵다. 병원에서 조사한 기록이 있다면 대조할 수 있을 듯하다.",
      "배낭 안을 더듬던 손을 거둔다. 꺼내 먹을 것은 남지 않았다."
    ]
  },
  {
    "id": "local.text.814",
    "eventId": "encounter.inpatient-ward",
    "choiceId": null,
    "slot": "scene",
    "conditions": [
      {
        "kind": "number",
        "subject": "protagonist",
        "stat": "injury",
        "min": 1,
        "max": 2
      }
    ],
    "priority": 2,
    "weight": 1,
    "once": false,
    "text": [
      "병동 끝 지도에 지하철 진입로와 학교 운동장 접선지가 표시돼 있다. 어느 길로 남쪽을 향할지 결정할 때다.",
      "그 옆에는 봉쇄된 연구동의 수송 표지가 붙어 있다. 표지만 보고 출입로를 찾기는 어렵다. 병원에서 조사한 기록이 있다면 대조할 수 있을 듯하다.",
      "다친 쪽에 체중이 실리자 걸음이 멈칫한다."
    ]
  },
  {
    "id": "local.text.815",
    "eventId": "encounter.inpatient-ward",
    "choiceId": null,
    "slot": "scene",
    "conditions": [
      {
        "kind": "number",
        "subject": "protagonist",
        "stat": "stress",
        "min": 61,
        "max": 100
      }
    ],
    "priority": 3,
    "weight": 1,
    "once": false,
    "text": [
      "병동 끝 지도에 지하철 진입로와 학교 운동장 접선지가 표시돼 있다. 어느 길로 남쪽을 향할지 결정할 때다.",
      "그 옆에는 봉쇄된 연구동의 수송 표지가 붙어 있다. 표지만 보고 출입로를 찾기는 어렵다. 병원에서 조사한 기록이 있다면 대조할 수 있을 듯하다.",
      "말라붙은 입술을 축인다. 작은 소리까지 구분하려 하니 숨이 짧아진다."
    ]
  },
  {
    "id": "local.text.816",
    "eventId": "encounter.inpatient-ward",
    "choiceId": null,
    "slot": "hesitation",
    "conditions": [
      {
        "kind": "companion",
        "present": true
      }
    ],
    "priority": 0,
    "weight": 1,
    "once": false,
    "text": [
      "“저 길로 가면 무엇을 얻을지는 알겠어. 그런데 지금 우리가 버틸 수 있을지가 마음에 걸려.”"
    ]
  },
  {
    "id": "local.text.817",
    "eventId": "encounter.inpatient-ward",
    "choiceId": null,
    "slot": "absent",
    "conditions": [
      {
        "kind": "companion",
        "present": false
      }
    ],
    "priority": 0,
    "weight": 1,
    "once": false,
    "text": [
      "두 사람 몫의 간격을 두고 걷다가 걸음을 고친다. 지금은 내 발소리만 따라온다."
    ]
  },
  {
    "id": "local.text.818",
    "eventId": "encounter.inpatient-ward",
    "choiceId": null,
    "slot": "reunion",
    "conditions": [
      {
        "kind": "companion",
        "present": true
      }
    ],
    "priority": 0,
    "weight": 1,
    "once": false,
    "text": [
      "익숙한 얼굴이 보이자 부르려던 목소리가 멎는다. 동료도 몇 걸음 앞에서 멈춘다. “네가 먼저 간 건 알아. 그래도 여기서 다시 만나고 싶었어.”",
      "“아직 같은 생각은 아니야.” 말하자 동료가 고개를 끄덕인다. 가방을 고쳐 메며 옆자리를 내준다. 하지 못한 말까지 풀린 것은 아니지만, 다음 길은 다시 나란히 살핀다."
    ]
  },
  {
    "id": "encounter.inpatient-ward.clue-scene.0",
    "eventId": "encounter.inpatient-ward",
    "choiceId": null,
    "slot": "scene",
    "conditions": [
      {
        "kind": "fact",
        "id": "research-clue",
        "value": true
      }
    ],
    "priority": 100,
    "weight": 1,
    "once": false,
    "text": [
      "입원 병동 끝 지도에는 지하철 진입로와 학교 운동장 접선지가 표시돼 있다. 앞서 조사한 수송 기록과 표식이 일치한다. 봉쇄된 연구동으로 들어갈 직원 출입로를 찾았다."
    ]
  },
  {
    "id": "encounter.inpatient-ward.clue-scene.1",
    "eventId": "encounter.inpatient-ward",
    "choiceId": null,
    "slot": "scene",
    "conditions": [
      {
        "kind": "resource",
        "resource": "supply",
        "min": 0,
        "max": 0
      },
      {
        "kind": "fact",
        "id": "research-clue",
        "value": true
      }
    ],
    "priority": 101,
    "weight": 1,
    "once": false,
    "text": [
      "입원 병동 끝 지도에는 지하철 진입로와 학교 운동장 접선지가 표시돼 있다. 앞서 조사한 수송 기록과 표식이 일치한다. 봉쇄된 연구동으로 들어갈 직원 출입로를 찾았다.",
      "배낭 안을 더듬던 손을 거둔다. 꺼내 먹을 것은 남지 않았다."
    ]
  },
  {
    "id": "encounter.inpatient-ward.clue-scene.2",
    "eventId": "encounter.inpatient-ward",
    "choiceId": null,
    "slot": "scene",
    "conditions": [
      {
        "kind": "number",
        "subject": "protagonist",
        "stat": "injury",
        "min": 1,
        "max": 2
      },
      {
        "kind": "fact",
        "id": "research-clue",
        "value": true
      }
    ],
    "priority": 102,
    "weight": 1,
    "once": false,
    "text": [
      "입원 병동 끝 지도에는 지하철 진입로와 학교 운동장 접선지가 표시돼 있다. 앞서 조사한 수송 기록과 표식이 일치한다. 봉쇄된 연구동으로 들어갈 직원 출입로를 찾았다.",
      "다친 쪽에 체중이 실리자 걸음이 멈칫한다."
    ]
  },
  {
    "id": "encounter.inpatient-ward.clue-scene.3",
    "eventId": "encounter.inpatient-ward",
    "choiceId": null,
    "slot": "scene",
    "conditions": [
      {
        "kind": "number",
        "subject": "protagonist",
        "stat": "stress",
        "min": 61,
        "max": 100
      },
      {
        "kind": "fact",
        "id": "research-clue",
        "value": true
      }
    ],
    "priority": 103,
    "weight": 1,
    "once": false,
    "text": [
      "입원 병동 끝 지도에는 지하철 진입로와 학교 운동장 접선지가 표시돼 있다. 앞서 조사한 수송 기록과 표식이 일치한다. 봉쇄된 연구동으로 들어갈 직원 출입로를 찾았다.",
      "말라붙은 입술을 축인다. 작은 소리까지 구분하려 하니 숨이 짧아진다."
    ]
  }
]
